{
  "name": "Skype",
  "slug": "skype",
  "description": "Microsoft's video calling, messaging, and VoIP application \u2014 connect with anyone, anywhere",
  "website": "https://www.skype.com",
  "platform": "macOS",
  "architecture": "universal",
  "bundle_id": "com.skype.skype",
  "category": "messaging",
  "license": "free",
  "min_os": "macOS 11.0",
  "auto_updates": true,
  "skip": true,
  "version_check": {
    "method": "none",
    "url": "",
    "extraction": {
      "type": "none"
    }
  },
  "download": {
    "method": "direct_url",
    "url": "",
    "file_type": "dmg"
  },
  "changelog": {
    "method": "web_scrape",
    "url": "https://support.microsoft.com/en-us/skype/skype-for-mac-release-notes"
  },
  "last_updated": "2026-06-22",
  "notes": "DISCONTINUED \u2014 Skype was retired May 5, 2025 and replaced by Microsoft Teams. No further updates will be released."
}
