{
  "name": "Control D Utility",
  "slug": "control-d-utility",
  "description": "DNS/network control utility GUI app \u2014 companion to ctrld CLI daemon",
  "website": "https://controld.com",
  "platform": "macOS",
  "architecture": "universal (separate builds)",
  "min_os": "12.0",
  "auto_updates": true,
  "version_check": {
    "method": "github_api",
    "url": "https://api.github.com/repos/Control-D-Inc/ctrld/releases/latest",
    "extraction": {
      "type": "json_path",
      "path": "tag_name",
      "strip_prefix": "v",
      "example": "1.5.2"
    },
    "headers": {}
  },
  "download": {
    "method": "construct_url",
    "file_type": "dmg",
    "headers": {},
    "url": "https://github.com/Control-D-Inc/ctrld/releases/download/v1.5.2/ctrld_1.5.2_windows_386.zip"
  },
  "changelog": {
    "method": "github_releases",
    "url": "https://github.com/Control-D-Inc/ctrld/releases",
    "note": "Changelog from CLI daemon releases on GitHub"
  },
  "release_date": {
    "method": "github_api",
    "field": "published_at in GitHub release JSON"
  },
  "notes": "The GUI app auto-updates with no public Sparkle feed or version endpoint. The controld.com website is Cloudflare-protected (404 to automated fetchers). No Mac App Store \u2014 web-only distribution. The CLI daemon (ctrld) is open-source on GitHub with proper release versioning. Mapping GUI version to CLI version is approximate.",
  "last_updated": "2026-06-21",
  "$schema": "https://raw.githubusercontent.com/evenwebb/macupdater-profiles/main/schema.json",
  "category": "vpn-security",
  "license": "free",
  "skip": false
}
