{
  "name": "Trello",
  "slug": "trello",
  "description": "Visual project management tool that helps teams organize projects with boards, lists, and cards",
  "website": "https://trello.com",
  "platform": "macOS",
  "architecture": "universal",
  "bundle_id": "com.trello.Trello",
  "category": "office",
  "license": "free",
  "min_os": "macOS 12.0",
  "auto_updates": true,
  "skip": false,
  "version_check": {
    "method": "itunes_api",
    "url": "https://itunes.apple.com/lookup?id=1278508951",
    "extraction": {
      "type": "json_path",
      "path": "results.0.version"
    }
  },
  "download": {
    "method": "direct_url",
    "url": "https://apps.apple.com/app/trello/id1278508951",
    "file_type": "dmg"
  },
  "changelog": {
    "method": "web_scrape",
    "url": "https://trello.com/platforms"
  },
  "last_updated": "2026-06-22"
}
