{
  "name": "MacUpdater",
  "slug": "macupdater",
  "description": "macOS app update checker \u2014 scans installed apps and reports available updates",
  "website": "https://corecode.io/macupdater",
  "platform": "macOS",
  "architecture": "universal",
  "min_os": "10.14",
  "auto_updates": false,
  "version_check": {
    "method": "homebrew_cask_api",
    "url": "https://formulae.brew.sh/api/cask/macupdater.json",
    "extraction": {
      "type": "json_path",
      "path": "version",
      "example": "3.5.0"
    },
    "headers": {}
  },
  "download": {
    "method": "static_url",
    "latest": "https://www.corecode.io/downloads/macupdater_latest.dmg",
    "versioned": "https://www.corecode.io/downloads/macupdater_{VERSION}.dmg",
    "file_type": "dmg",
    "headers": {}
  },
  "changelog": {
    "method": "web_scrape",
    "url": "https://www.corecode.io/macupdater/history.html",
    "note": "HTML page listing all versions with dates and changes"
  },
  "release_date": {
    "method": "homebrew_cask_api",
    "field": "version (final release date not in API \u2014 use history page)",
    "note": "Final version 3.5.0 released January 2026"
  },
  "notes": "*** DISCONTINUED *** Final version 3.5.0, January 2026. No MacUpdater 4 coming. Backend update verification service shut down. CoreCode states: 'Our daily maintenance has been stopped and we don't verify updates anymore.' App is now free with all Pro features unlocked. Homebrew cask marked 'deprecated' with deprecation_date '2026-01-01'. This profile is preserved for existing installations but no new updates will appear.",
  "last_updated": "2026-06-21",
  "$schema": "https://raw.githubusercontent.com/evenwebb/macupdater-profiles/main/schema.json",
  "category": "utilities",
  "license": "free",
  "skip": true
}
