{
  "name": "Simplenote",
  "slug": "simplenote",
  "description": "The simplest way to keep notes , light, clean, and free with Markdown support and instant sync across devices",
  "website": "https://simplenote.com",
  "platform": "macOS",
  "architecture": "universal",
  "bundle_id": "com.automattic.simplenote",
  "category": "notes-writing",
  "license": "free",
  "min_os": "macOS 10.15",
  "auto_updates": true,
  "skip": false,
  "version_check": {
    "method": "github_api",
    "url": "https://api.github.com/repos/Automattic/simplenote-electron/releases/latest",
    "extraction": {
      "type": "json_path",
      "path": "tag_name"
    }
  },
  "download": {
    "method": "direct_url",
    "url": "https://simplenote.com/download",
    "file_type": "dmg"
  },
  "changelog": {
    "method": "github_api",
    "url": "https://api.github.com/repos/Automattic/simplenote/releases/latest"
  },
  "release_date": {
    "method": "github_api",
    "field": "published_at"
  },
  "last_updated": "2026-06-22"
}
